{
  "schemaVersion": 1,
  "contentVersion": "2026.08.25.2",
  "protocolEvidenceVersion": "native-v2",
  "providers": [
    {
      "provider": "openAI",
      "verifiedAt": "2026-08-24",
      "defaultBaseURL": "https://api.openai.com/v1",
      "defaultModel": "gpt-5.6-terra",
      "protocolStrategy": "openAIResponses",
      "discoveryStrategy": "openAIList",
      "providerCapabilities": {},
      "models": [
        {"id":"gpt-5.6","aliases":[],"lifecycle":"active","capabilities":{"writing":"supported","reasoning":"supported","nativeWebSearch":"supported","imageInput":"supported","pdfInput":"supported","genericFileInput":"supported","uploadedFile":"supported","fileSearch":"supported"},"strategies":{}},
        {"id":"gpt-5.6-sol","aliases":[],"lifecycle":"active","capabilities":{"writing":"supported","reasoning":"supported","nativeWebSearch":"supported","imageInput":"supported","pdfInput":"supported","genericFileInput":"supported","uploadedFile":"supported","fileSearch":"supported"},"strategies":{}},
        {"id":"gpt-5.6-terra","aliases":[],"lifecycle":"active","capabilities":{"writing":"supported","reasoning":"supported","nativeWebSearch":"supported","imageInput":"supported","pdfInput":"supported","genericFileInput":"supported","uploadedFile":"supported","fileSearch":"supported"},"strategies":{}},
        {"id":"gpt-5.6-luna","aliases":[],"lifecycle":"active","capabilities":{"writing":"supported","reasoning":"supported","nativeWebSearch":"supported","imageInput":"supported","pdfInput":"supported","genericFileInput":"supported","uploadedFile":"supported","fileSearch":"supported"},"strategies":{}}
      ],
      "families": [
        {"id":"gpt-5","prefixes":["gpt-5."],"excludedFragments":[],"capabilities":{"writing":"supported","reasoning":"supported","nativeWebSearch":"supported","imageInput":"supported","pdfInput":"supported","genericFileInput":"supported","uploadedFile":"supported","fileSearch":"supported"},"strategies":{}}
      ]
    },
    {
      "provider": "anthropic",
      "verifiedAt": "2026-08-24",
      "defaultBaseURL": "https://api.anthropic.com",
      "defaultModel": "claude-fable-5",
      "protocolStrategy": "anthropicMessages",
      "discoveryStrategy": "anthropicList",
      "providerCapabilities": {},
      "models": [
        {"id":"claude-fable-5","aliases":[],"lifecycle":"active","capabilities":{"writing":"supported","reasoning":"supported","nativeWebSearch":"supported","imageInput":"supported","pdfInput":"supported","genericFileInput":"supported","uploadedFile":"supported"},"strategies":{"reasoningStyle":"anthropicAdaptiveThinking"}},
        {"id":"claude-mythos-5","aliases":[],"lifecycle":"active","capabilities":{"writing":"supported","reasoning":"supported","nativeWebSearch":"unsupported","imageInput":"supported","pdfInput":"supported","genericFileInput":"supported","uploadedFile":"supported"},"strategies":{"reasoningStyle":"anthropicAdaptiveThinking"}},
        {"id":"claude-opus-4-8","aliases":[],"lifecycle":"active","capabilities":{"writing":"supported","reasoning":"supported","nativeWebSearch":"supported","imageInput":"supported","pdfInput":"supported","genericFileInput":"supported","uploadedFile":"supported"},"strategies":{"reasoningStyle":"anthropicAdaptiveThinking"}},
        {"id":"claude-opus-4-7","aliases":[],"lifecycle":"active","capabilities":{"writing":"supported","reasoning":"supported","nativeWebSearch":"supported","imageInput":"supported","pdfInput":"supported","genericFileInput":"supported","uploadedFile":"supported"},"strategies":{"reasoningStyle":"anthropicAdaptiveThinking"}},
        {"id":"claude-opus-4-6","aliases":[],"lifecycle":"active","capabilities":{"writing":"supported","reasoning":"supported","nativeWebSearch":"supported","imageInput":"supported","pdfInput":"supported","genericFileInput":"supported","uploadedFile":"supported"},"strategies":{}},
        {"id":"claude-sonnet-5","aliases":[],"lifecycle":"active","capabilities":{"writing":"supported","reasoning":"supported","nativeWebSearch":"supported","imageInput":"supported","pdfInput":"supported","genericFileInput":"supported","uploadedFile":"supported"},"strategies":{"reasoningStyle":"anthropicAdaptiveThinking"}},
        {"id":"claude-sonnet-4-6","aliases":[],"lifecycle":"active","capabilities":{"writing":"supported","reasoning":"supported","nativeWebSearch":"supported","imageInput":"supported","pdfInput":"supported","genericFileInput":"supported","uploadedFile":"supported"},"strategies":{}}
      ],
      "families": [
        {"id":"claude-input","prefixes":["claude-"],"excludedFragments":[],"capabilities":{"writing":"supported","imageInput":"supported","pdfInput":"supported","genericFileInput":"supported","uploadedFile":"supported"},"strategies":{}},
        {"id":"claude-fable","prefixes":["claude-fable-5-"],"excludedFragments":[],"capabilities":{"reasoning":"supported","nativeWebSearch":"supported"},"strategies":{}},
        {"id":"claude-mythos","prefixes":["claude-mythos-5-"],"excludedFragments":[],"capabilities":{"reasoning":"supported","nativeWebSearch":"unsupported"},"strategies":{}},
        {"id":"claude-opus","prefixes":["claude-opus-4-8-","claude-opus-4-7-","claude-opus-4-6-"],"excludedFragments":[],"capabilities":{"reasoning":"supported","nativeWebSearch":"supported"},"strategies":{}},
        {"id":"claude-sonnet","prefixes":["claude-sonnet-5-","claude-sonnet-4-6-"],"excludedFragments":[],"capabilities":{"reasoning":"supported","nativeWebSearch":"supported"},"strategies":{}}
      ]
    },
    {
      "provider": "gemini",
      "verifiedAt": "2026-08-25",
      "defaultBaseURL": "https://generativelanguage.googleapis.com",
      "defaultModel": "gemini-3.7-flash",
      "protocolStrategy": "geminiInteractions",
      "discoveryStrategy": "geminiList",
      "providerCapabilities": {},
      "models": [
        {"id":"gemini-3.7-flash","aliases":[],"lifecycle":"active","capabilities":{"writing":"supported","reasoning":"supported","nativeWebSearch":"supported","imageInput":"supported","pdfInput":"supported","genericFileInput":"supported","uploadedFile":"supported","fileSearch":"supported"},"strategies":{}},
        {"id":"gemini-3.6-flash","aliases":[],"lifecycle":"active","capabilities":{"writing":"supported","reasoning":"supported","nativeWebSearch":"supported","imageInput":"supported","pdfInput":"supported","genericFileInput":"supported","uploadedFile":"supported","fileSearch":"supported"},"strategies":{}},
        {"id":"gemini-3.5-flash","aliases":[],"lifecycle":"active","capabilities":{"writing":"supported","reasoning":"supported","nativeWebSearch":"supported","imageInput":"supported","pdfInput":"supported","genericFileInput":"supported","uploadedFile":"supported","fileSearch":"supported"},"strategies":{}},
        {"id":"gemini-3.5-flash-lite","aliases":[],"lifecycle":"active","capabilities":{"writing":"supported","reasoning":"supported","nativeWebSearch":"supported","imageInput":"supported","pdfInput":"supported","genericFileInput":"supported","uploadedFile":"supported","fileSearch":"supported"},"strategies":{}},
        {"id":"gemini-3.1-pro-preview","aliases":[],"lifecycle":"active","capabilities":{"writing":"supported","reasoning":"supported","nativeWebSearch":"supported","imageInput":"supported","pdfInput":"supported","genericFileInput":"supported","uploadedFile":"supported","fileSearch":"supported"},"strategies":{}},
        {"id":"gemini-3.1-flash-lite","aliases":[],"lifecycle":"active","capabilities":{"writing":"supported","reasoning":"supported","nativeWebSearch":"supported","imageInput":"supported","pdfInput":"supported","genericFileInput":"supported","uploadedFile":"supported","fileSearch":"supported"},"strategies":{}},
        {"id":"gemini-3-flash-preview","aliases":[],"lifecycle":"active","capabilities":{"writing":"supported","reasoning":"supported","nativeWebSearch":"supported","imageInput":"supported","pdfInput":"supported","genericFileInput":"supported","uploadedFile":"supported","fileSearch":"supported"},"strategies":{}},
        {"id":"gemini-2.5-pro","aliases":[],"lifecycle":"active","capabilities":{"writing":"supported","reasoning":"supported","nativeWebSearch":"supported","imageInput":"supported","pdfInput":"supported","genericFileInput":"supported","uploadedFile":"supported"},"strategies":{}},
        {"id":"gemini-2.5-flash","aliases":[],"lifecycle":"active","capabilities":{"writing":"supported","reasoning":"supported","nativeWebSearch":"supported","imageInput":"supported","pdfInput":"supported","genericFileInput":"supported","uploadedFile":"supported"},"strategies":{}},
        {"id":"gemini-2.5-flash-lite","aliases":[],"lifecycle":"active","capabilities":{"writing":"supported","reasoning":"supported","nativeWebSearch":"supported","imageInput":"supported","pdfInput":"supported","genericFileInput":"supported","uploadedFile":"supported"},"strategies":{}}
      ],
      "families": [
        {"id":"gemini-writing","prefixes":["gemini-3.","gemini-2.5-"],"excludedFragments":["-image","-live","-tts","embedding","robotics","omni"],"capabilities":{"writing":"supported","reasoning":"supported","nativeWebSearch":"supported","imageInput":"supported","pdfInput":"supported","genericFileInput":"supported","uploadedFile":"supported"},"strategies":{}},
        {"id":"gemini-file-search","prefixes":["gemini-3."],"excludedFragments":["-image","-live","-tts","embedding","robotics","omni"],"capabilities":{"fileSearch":"supported"},"strategies":{}}
      ]
    },
    {
      "provider": "kimi",
      "verifiedAt": "2026-08-25",
      "defaultBaseURL": "https://api.moonshot.cn/v1",
      "defaultModel": "kimi-k2.6",
      "protocolStrategy": "kimiChat",
      "discoveryStrategy": "kimiList",
      "providerCapabilities": {"nativeWebSearch":"supported","pdfInput":"supported","genericFileInput":"supported","uploadedFile":"supported","fileExtraction":"supported"},
      "models": [